[
  {
    "id": "1",
    "title": "PRAYSAP",
    "description": "The only app to connect with Muslims to prayers. Making prayers a habit with the Ummah.",
    "status": "in-progress",
    "url": "https://praysap.com",
    "emoji": "ü§≤",
    "requirements": [
      "Real-time prayer time notifications based on user location",
      "Nearby Muslim discovery for congregation prayers",
      "Prayer streak tracking and gamification",
      "Mosque finder with walking directions",
      "Community prayer challenges and leaderboards",
      "Integration with smart home devices for adhaan",
      "Accessibility features for visually impaired users"
    ],
    "slug": "praysap",
    "quality": "amazing"
  },
  {
    "id": "30",
    "title": "SunnahSleep",
    "description": "Cure insomnia with Sunnah based practices",
    "status": "production",
    "url": "https://SunnahSleep.com",
    "emoji": "üåô",
    "requirements": [
      "Comprehensive Sunnah sleep checklist with detailed Hadith references",
      "Quranic recitations with audio (Ayat al-Kursi, last verses of Baqarah, Three Quls)",
      "Tasbih counter for bedtime dhikr",
      "Sleep tracking with Isha/Fajr prayer adherence monitoring",
      "Smart prayer alarms including Tahajjud calculations",
      "Progressive Web App ‚Äî works offline, no installation required"
    ],
    "slug": "sunnahsleep",
    "quality": "good"
  },
  {
    "id": "2",
    "title": "JummahDAO",
    "description": "Community to meetup for Friday prayers at crypto events. Connecting the Web3 Muslim community.",
    "status": "in-progress",
    "url": "https://jummahdao.com",
    "emoji": "üïå",
    "requirements": [
      "Event-based Jummah prayer coordination",
      "Web3 wallet integration for membership",
      "Conference and event schedule integration",
      "Community governance for event planning",
      "NFT-based membership and attendance tracking",
      "Chat and networking features for Muslim Web3 professionals"
    ],
    "slug": "jummahdao",
    "quality": "okay"
  },
  {
    "id": "3",
    "title": "Mosque Database",
    "description": "Database of every mosque, their prayer times, Khutbah information as open API.",
    "status": "ideating",
    "emoji": "üóÑÔ∏è",
    "requirements": [
      "Global mosque directory with verified information",
      "Prayer time API with multiple calculation methods",
      "Khutbah schedules and searchable archives",
      "Imam and scholar profiles",
      "Facilities information (parking, accessibility, women's section)",
      "Community ratings and reviews",
      "Public API for developers",
      "Community data contribution system",
      "Geolocation-based mosque discovery",
      "Multi-language support",
      "Historical prayer time data",
      "Qibla direction for each location",
      "Event calendar (weekly programs, Ramadan activities)",
      "Photo galleries and virtual tours",
      "Contact information and links",
      "Capacity and space information",
      "Map visualization with search",
      "Mobile apps for iOS and Android"
    ],
    "slug": "mosque-database",
    "quality": "okay"
  },
  {
    "id": "4",
    "title": "MosqueTV",
    "description": "A comprehensive media platform for discovering and accessing mosque livestreams worldwide.",
    "status": "ideating",
    "emoji": "üì∫",
    "requirements": [
      "Directory of mosque livestreams worldwide",
      "Community-submitted streams with verification",
      "Multi-language support",
      "Prayer time-based recommendations",
      "Stream archive and recordings",
      "Mobile apps with background audio",
      "Smart TV and Chromecast support",
      "Stream quality selection",
      "Favorite mosques and notifications",
      "Schedule calendar for upcoming streams",
      "Video player with playback controls",
      "Regional filtering",
      "Prayer-specific categorization",
      "Qari and reciter information",
      "Playlists and favorites",
      "Offline download for archived streams",
      "Search across streams and mosques",
      "Audio-only mode"
    ],
    "slug": "mosquetv",
    "quality": "okay"
  },
  {
    "id": "5",
    "title": "Khutbah Sentiment",
    "description": "AI platform that aggregates Friday khutbah speeches, analyzing sentiment, themes, and topics.",
    "status": "ideating",
    "emoji": "üìä",
    "requirements": [
      "Speech-to-text transcription for khutbahs",
      "Sentiment and topic analysis",
      "Weekly trend reports with visualizations",
      "Searchable archive by theme, keyword, date, and location",
      "Comparative analysis across regions",
      "Imam dashboard with engagement metrics",
      "Multi-language support",
      "Automatic topic classification",
      "Emotion detection",
      "Quranic verse and hadith extraction",
      "Keyword frequency and trending topics",
      "Sentiment scoring",
      "Geographic topic heat maps",
      "Time-series trend analysis",
      "Related khutbah recommendations",
      "Export for research (CSV, JSON, PDF)",
      "Automated summaries",
      "Citation tracking",
      "Custom alerts for topics",
      "Data visualizations (charts, graphs, word clouds)",
      "Historical comparisons",
      "Mobile apps"
    ],
    "slug": "khutbah-sentiment",
    "quality": "okay"
  },
  {
    "id": "6",
    "title": "Imam Khutbah Assistant",
    "description": "AI-powered platform providing real-time translation of khutbahs and referenced Quranic verses.",
    "status": "ideating",
    "emoji": "üéôÔ∏è",
    "requirements": [
      "Real-time speech translation to multiple languages",
      "Automatic Quranic verse detection with Arabic and translations",
      "Tafsir integration for referenced verses",
      "Hadith reference lookup with grading",
      "Livestream integration",
      "Audience Q&A with moderation",
      "Post-khutbah study sessions",
      "Sign language interpretation and live captions",
      "Multi-language subtitles",
      "Customizable display themes",
      "Note-taking with sync",
      "Translation quality indicators",
      "Islamic terminology dictionary",
      "Background noise reduction",
      "Mobile apps",
      "Imam preparation tools",
      "Historical context information",
      "Recording with synchronized transcripts",
      "Share key moments",
      "Offline mode",
      "Export transcripts and translations",
      "Content quizzes"
    ],
    "slug": "imam-khutbah-assistant",
    "quality": "amazing"
  },
  {
    "id": "7",
    "title": "Wudu Hero",
    "description": "Gamified wudu teaching app using computer vision to track movements and provide feedback.",
    "status": "ideating",
    "emoji": "ü¶∏",
    "requirements": [
      "Computer vision for wudu step detection",
      "Real-time movement tracking via camera",
      "Gamification with points, badges, and achievements",
      "Multiple madhab support",
      "Voice guidance in multiple languages",
      "Practice mode for beginners",
      "Family leaderboards and challenges",
      "Sunnah practice tracking",
      "Step-by-step visual guides",
      "Progress tracking and streaks",
      "Customizable difficulty levels",
      "Video tutorials",
      "Error detection and corrections",
      "Accessibility features",
      "Offline functionality",
      "Child-friendly interface",
      "Adult mode with fiqh explanations",
      "Timer for wudu duration",
      "Practice reminders",
      "Statistics dashboard",
      "Multi-user family accounts",
      "Parental controls",
      "Certification system",
      "Madhab comparison mode",
      "Audio and visual feedback",
      "Slow-motion replay",
      "Community challenges",
      "Wudu fiqh reference library"
    ],
    "slug": "wudu-hero",
    "quality": "okay"
  },
  {
    "id": "8",
    "title": "Lower Your Gaze",
    "description": "First-person game practicing the Islamic principle of lowering gaze with eye-tracking technology.",
    "status": "ideating",
    "emoji": "üëÅÔ∏è",
    "requirements": [
      "First-person city navigation gameplay",
      "Eye-tracking integration",
      "Score-based gaze avoidance mechanics",
      "Progressive difficulty levels",
      "Islamic reminders and hadith integration",
      "Offline playability",
      "Multiple environment scenarios",
      "Real-time gaze direction visualization",
      "Virtual character interactions",
      "Achievement system",
      "Daily challenges",
      "Statistics tracking",
      "Customizable sensitivity settings",
      "Educational content on lowering gaze",
      "Multi-platform support (PC, mobile, VR)",
      "Story mode",
      "Time-based challenges",
      "Replay system",
      "Meditation exercises",
      "Community leaderboards",
      "Parental controls",
      "Real-world application tips",
      "Custom scenario creation",
      "Co-op mode",
      "Reward system with spiritual insights",
      "Adaptive difficulty",
      "Quranic verses and hadith during gameplay",
      "Multiple character avatars",
      "Progress reports"
    ],
    "slug": "lower-your-gaze",
    "quality": "okay"
  },
  {
    "id": "9",
    "title": "Travel Mode",
    "description": "Feature to adjust prayer times and enable shortened prayers (Qasr) for traveling Muslims.",
    "status": "ideating",
    "emoji": "‚úàÔ∏è",
    "requirements": [
      "Automatic travel detection via GPS",
      "Qasr prayer notifications and guidance",
      "Multiple madhab rulings support",
      "Combining prayers (Jam') guidance",
      "Airport and transit prayer room finder",
      "Qibla direction for moving vehicles",
      "Offline functionality for flights",
      "Duration-based travel status",
      "Customizable travel dates",
      "Prayer time adjustments for travel",
      "Flight booking integration",
      "Hotel prayer room information",
      "Travel checklist for Islamic essentials",